{
  "$schema": "../schema/library-manifest.schema.json",
  "schemaVersion": 1,
  "id": "turtle-tracer-lib",
  "name": "TurtleTracerLib",
  "description": "Pedro Pathing add-on for running paths planned in Turtle Tracer, with path events and command-based path following.",
  "category": "pathing",
  "maintainers": [
    {
      "name": "Mallen220",
      "url": "https://github.com/Mallen220"
    }
  ],
  "repository": "https://github.com/Mallen220/TurtleTracerLib",
  "documentation": "https://github.com/Mallen220/TurtleTracerLib#readme",
  "license": "Apache-2.0",
  "mavenRepositories": [
    {
      "name": "Dairy Foundation",
      "url": "https://repo.dairy.foundation/releases"
    },
    {
      "name": "Panels",
      "url": "https://mymaven.bylazar.com/releases"
    },
    {
      "name": "JitPack",
      "url": "https://jitpack.io"
    }
  ],
  "artifacts": [
    {
      "coordinate": "com.github.Mallen220:TurtleTracerLib",
      "role": "primary"
    }
  ],
  "packages": [
    "com.turtletracerlib"
  ],
  "versions": [
    {
      "version": "3.0.3",
      "released": "2026-10-03",
      "artifacts": {
        "com.github.Mallen220:TurtleTracerLib": "3.0.3"
      },
      "notes": "The README builds it against Pedro Pathing 3.0.1."
    },
    {
      "version": "3.0.0",
      "released": "2026-09-16",
      "artifacts": {
        "com.github.Mallen220:TurtleTracerLib": "3.0.0"
      }
    }
  ],
  "install": {
    "target": "teamcode",
    "postInstall": [
      "Plan your paths in Turtle Tracer (https://github.com/Mallen220/TurtleTracer/releases), then export Java code or a .turt file to use with TurtleTracerReader."
    ]
  },
  "sloth": {
    "compatibility": "unknown"
  },
  "requires": [
    {
      "library": "pedro-pathing",
      "reason": "TurtleTracerLib is built on Pedro Pathing and does not bring it in."
    }
  ],
  "verification": {
    "sources": [
      "https://github.com/Mallen220/TurtleTracerLib",
      "https://jitpack.io/api/builds/com.github.Mallen220/TurtleTracerLib"
    ],
    "checkedAt": "2026-10-16",
    "notes": "Published through JitPack from the repository's tags; the README also suggests master-SNAPSHOT, which FTC Core does not offer. The library's POM lists no dependencies, so Pedro Pathing has to be installed separately."
  }
}
